{
  "$schema": "https://json-schema.org/draft/2020-12/schema",
  "$id": "https://aftergraph.org/contracts/roro/0.1/consolidation-simulation.schema.json",
  "title": "R.O.R.O. Consolidation Simulation 0.1",
  "type": "object",
  "required": ["schema_version", "source_snapshot_generated_at", "gate_scope", "policy", "candidates"],
  "properties": {
    "schema_version": {"const": "roro-consolidation-simulation/0.1"},
    "source_snapshot_generated_at": {"type": "string", "minLength": 1},
    "gate_scope": {"const": "SOURCE_TOPOLOGY_ONLY"},
    "policy": {"type": "object"},
    "candidates": {"type": "array", "minItems": 1, "items": {"type": "object", "required": ["candidate_id", "workspace_count", "hard_blockers", "dimensions", "workspace_summaries"], "properties": {
      "candidate_id": {"type": "string", "minLength": 1},
      "workspace_count": {"type": "integer", "minimum": 2},
      "hard_blockers": {"type": "array"},
      "dimensions": {"type": "object"},
      "workspace_summaries": {"type": "array"}
    }, "additionalProperties": false}}
  },
  "additionalProperties": false
}
