{
  "candidates": [
    {
      "candidate_id": "ws2-visibility-only",
      "dimensions": {
        "cross_workspace_dependency_edges": 31,
        "deployment_colocation_pairs": 9,
        "domain_platform_colocations": 26,
        "largest_workspace_repositories": 16,
        "legacy_canonical_colocations": 14,
        "mixed_visibility_workspaces": 0,
        "research_production_colocations": 51,
        "trust_boundary_colocations": 6
      },
      "hard_blockers": [],
      "workspace_count": 2,
      "workspace_summaries": [
        {
          "repository_count": 16,
          "visibility": "public",
          "workspace_id": "public"
        },
        {
          "repository_count": 15,
          "visibility": "private",
          "workspace_id": "internal"
        }
      ]
    },
    {
      "candidate_id": "ws3-research-isolated",
      "dimensions": {
        "cross_workspace_dependency_edges": 36,
        "deployment_colocation_pairs": 9,
        "domain_platform_colocations": 26,
        "largest_workspace_repositories": 15,
        "legacy_canonical_colocations": 14,
        "mixed_visibility_workspaces": 0,
        "research_production_colocations": 36,
        "trust_boundary_colocations": 6
      },
      "hard_blockers": [],
      "workspace_count": 3,
      "workspace_summaries": [
        {
          "repository_count": 15,
          "visibility": "public",
          "workspace_id": "platform-public"
        },
        {
          "repository_count": 1,
          "visibility": "public",
          "workspace_id": "research-public"
        },
        {
          "repository_count": 15,
          "visibility": "private",
          "workspace_id": "internal"
        }
      ]
    },
    {
      "candidate_id": "ws4-legacy-isolated",
      "dimensions": {
        "cross_workspace_dependency_edges": 37,
        "deployment_colocation_pairs": 7,
        "domain_platform_colocations": 24,
        "largest_workspace_repositories": 15,
        "legacy_canonical_colocations": 0,
        "mixed_visibility_workspaces": 0,
        "research_production_colocations": 33,
        "trust_boundary_colocations": 6
      },
      "hard_blockers": [],
      "workspace_count": 4,
      "workspace_summaries": [
        {
          "repository_count": 15,
          "visibility": "public",
          "workspace_id": "platform-public"
        },
        {
          "repository_count": 1,
          "visibility": "public",
          "workspace_id": "research-public"
        },
        {
          "repository_count": 14,
          "visibility": "private",
          "workspace_id": "internal-active"
        },
        {
          "repository_count": 1,
          "visibility": "private",
          "workspace_id": "legacy-private"
        }
      ]
    },
    {
      "candidate_id": "ws5-verifier-split",
      "dimensions": {
        "cross_workspace_dependency_edges": 55,
        "deployment_colocation_pairs": 3,
        "domain_platform_colocations": 24,
        "largest_workspace_repositories": 14,
        "legacy_canonical_colocations": 0,
        "mixed_visibility_workspaces": 0,
        "research_production_colocations": 33,
        "trust_boundary_colocations": 3
      },
      "hard_blockers": [],
      "workspace_count": 5,
      "workspace_summaries": [
        {
          "repository_count": 4,
          "visibility": "public",
          "workspace_id": "control-public"
        },
        {
          "repository_count": 11,
          "visibility": "public",
          "workspace_id": "verification-experience-public"
        },
        {
          "repository_count": 1,
          "visibility": "public",
          "workspace_id": "research-public"
        },
        {
          "repository_count": 14,
          "visibility": "private",
          "workspace_id": "internal-active"
        },
        {
          "repository_count": 1,
          "visibility": "private",
          "workspace_id": "legacy-private"
        }
      ]
    }
  ],
  "gate_scope": "SOURCE_TOPOLOGY_ONLY",
  "policy": {
    "candidate_is_hypothesis_not_decision": true,
    "multidimensional_only": true,
    "runtime_state_credential_authority_migrations_excluded": true,
    "workspace_is_not_security_boundary": true
  },
  "schema_version": "roro-consolidation-simulation/0.1",
  "source_snapshot_generated_at": "2026-09-16T08:04:39Z"
}
